{
  "schema": "echelon.execution-envelope/v1",
  "operationId": "op-followup-0002",
  "correlationId": "corr-2026-09-26-02",
  "timestamp": "2026-09-26T11:00:00+02:00",
  "actor": {
    "kind": "human",
    "provider": { "state": "not-applicable" },
    "identity": { "state": "known", "value": "kevin" }
  }
}
