{
  "schema": "echelon.execution-envelope/v1",
  "operationId": "op-7f3c",
  "correlationId": "corr-19a2",
  "timestamp": "2026-09-26T14:00:00Z",
  "actor": {
    "kind": "agent",
    "provider": {
      "state": "known",
      "value": "openai"
    },
    "identity": {
      "state": "known",
      "value": "openai/codex"
    },
    "runId": {
      "state": "unknown"
    }
  },
  "source": {
    "repository": {
      "state": "known",
      "value": "kemiller2002/app"
    },
    "branch": {
      "state": "known",
      "value": "main"
    },
    "commit": {
      "state": "unknown"
    },
    "workItem": {
      "state": "not-applicable"
    }
  }
}
