{
  "schema": "echelon.execution-envelope/v1",
  "operationId": "op-7f3c",
  "correlationId": "corr-19a2",
  "timestamp": "2026-09-26T14:00:00Z",
  "actor": {
    "kind": "system",
    "provider": {
      "state": "unknown"
    },
    "identity": {
      "state": "known",
      "value": "echelon/vigila"
    }
  }
}
